filename,abstract,aspect_annotation,aspects
it-3633-2-kz.txt,"Үлкен деректер бизнестiң көптеген салаларында кеңiнен қолданыс тапқан. Ұйымдар арасындағы ақпараттарды жүйелi түрде шығаруға және мәлiметтердi өңдейдi, жинаған мәлiметтер атрибуттарда айтарлықтай ерекшеленедi. Гетерогендi мәлiметтер жиынтығын құра отырып, олар бiр-бiрiн толықтырады, сондықтан ұйымдар арасында мәлiметтер алмасу қажет. Гетерогендi деректерге негiзделген машиналық оқытуды бiрлесiп оқыту процесiнде қазiргi сызба көптеген мәселелерге ие, соның iшiнде нақты жағдайларда тиiмдiлiк, қауiпсiздiк және қол жетiмдiлiк. Бұл мақалада бiз консорциум блокчейнiне және шектi гомоморфты шифрлау алгоритмiне негiзделген қауiпсiз ТВӘ оқыту механизмiн ұсынамыз. Консорциум блокчейнiн енгiзу арқылы орталықтандырылмаған деректер алмасу платформасын құруға, сонымен қатар шектi гомоморфты шифрлау негiзiнде тiрек-векторлар әдiсi классификаторының қауiпсiз алгоритмiн құруға болады.","Үлкен деректер бизнестiң көптеген салаларында кеңiнен қолданыс тапқан. Ұйымдар арасындағы ақпараттарды жүйелi түрде шығаруға және мәлiметтердi өңдейдi, жинаған мәлiметтер атрибуттарда айтарлықтай ерекшеленедi. Гетерогендi мәлiметтер жиынтығын құра отырып, олар бiр-бiрiн толықтырады, сондықтан ұйымдар арасында мәлiметтер алмасу қажет. Гетерогендi деректерге негiзделген машиналық оқытуды бiрлесiп оқыту процесiнде қазiргi сызба көптеген мәселелерге ие, соның iшiнде нақты жағдайларда тиiмдiлiк, қауiпсiздiк және қол жетiмдiлiк. [Бұл мақалада бiз консорциум блокчейнiне және шектi гомоморфты шифрлау алгоритмiне негiзделген қауiпсiз ТВӘ оқыту механизмiн ұсынамыз|F1|AIM]. [Консорциум блокчейнiн|F2|METHOD] енгiзу арқылы орталықтандырылмаған деректер алмасу платформасын құруға, сонымен қатар шектi [гомоморфты шифрлау негiзiнде тiрек-векторлар әдiсi |F3|METHOD][классификаторының қауiпсiз алгоритмiн құруға болады|F4|RESULT].","F1 AIM Бұл мақалада бiз консорциум блокчейнiне және шектi гомоморфты шифрлау алгоритмiне негiзделген қауiпсiз ТВӘ оқыту механизмiн ұсынамыз
F2 METHOD Консорциум блокчейнiн
F3 METHOD гомоморфты шифрлау негiзiнде тiрек-векторлар әдiсi 
F4 RESULT классификаторының қауiпсiз алгоритмiн құруға болады
"
it-3750-2-kz.txt,"Жүрек ауруларын анықтаудың дәлдiгiн арттыру машиналық оқыту саласында кеңiнен зерттелуде. Мұндай зерттеу денсаулық сақтау саласында үлкен шығындардың алдын алу үшiн және қате диагноздың қойылу себептерiнен туындайды. Нәтижесiнде дәрiгерлердiң тәжiрибесиндегi айырмашылықтарды азайтуға және медициналық шығындар мен қателiктердi төмендетуге бағытталған ауру факторларын талдаудың әртүрлi әдiстерi ұсынылады. Бұл зерттеуде классификациялық оқытудың 6 алгоритмң, соның iшiнде атап айтқанда жiктеу ағашы, жақын көршiлер әдiсi, аңғал Байес, кезейсоқ орман ағашы, бустинг әдiстерi қолданылды. Осы әдiстердi Клевеленд университетiнiң жинақтаған heart.csv датасетiне қолдану арқылы жүрек аурулары бойынша машинаға тиiмдi және дәлдiгi жоғары болатын болжам жасау үйретiлдi. Алгоритмдердiң болжау қабiлетiн арттыру мақсатында барлық әдiстер бiрiншi кезекте стандартталмаған деректерге оқытылды. Standart Scaler әдiсiн қолдану арқылы деректердi стандартизациялау нәтижеге қаншалықты әсер ететiнiне зерттеу жүргiзiлдi. Зерттеу барысында бұл әдiс KNN мен SVC секiлдi алгоритмдерге нәтиженi шамамен 25%-ға жақсартуға көмек беретiнi анықталды.","Жүрек ауруларын анықтаудың дәлдiгiн арттыру машиналық оқыту саласында кеңiнен зерттелуде. Мұндай зерттеу [денсаулық сақтау саласында үлкен шығындардың алдын алу үшiн және қате диагноздың қойылу себептерiнен туындайды|F1|AIM]. Нәтижесiнде [дәрiгерлердiң тәжiрибесиндегi айырмашылықтарды азайтуға және медициналық шығындар мен қателiктердi төмендетуге бағытталған ауру факторларын талдаудың әртүрлi әдiстерi ұсынылады|F2|TASK]. Бұл зерттеуде классификациялық оқытудың 6 алгоритмң, соның iшiнде атап айтқанда [жiктеу ағашы|F3|METHOD], [жақын көршiлер әдiсi|F4|METHOD], [аңғал Байес|F5|METHOD], [кезейсоқ орман ағашы|F6|METHOD], [бустинг әдiстерi|F7|METHOD] қолданылды. Осы әдiстердi Клевеленд университетiнiң жинақтаған [heart.csv датасетiне|F8|MATERIAL] қолдану арқылы [жүрек аурулары бойынша машинаға тиiмдi және дәлдiгi жоғары болатын болжам жасау үйретiлдi|F9|RESULT]. [Алгоритмдердiң болжау қабiлетiн арттыру мақсатында барлық әдiстер бiрiншi кезекте стандартталмаған деректерге оқытылды|F10|TASK]. [Standart Scaler әдiсiн қолдану арқылы деректердi стандартизациялау нәтижеге қаншалықты әсер ететiнiне зерттеу жүргiзiлдi|F11|RESULT]. Зерттеу барысында [бұл әдiс KNN мен SVC секiлдi алгоритмдерге нәтиженi шамамен 25%-ға жақсартуға көмек беретiнi анықталды|F12|RESULT].","F1 AIM денсаулық сақтау саласында үлкен шығындардың алдын алу үшiн және қате диагноздың қойылу себептерiнен туындайды
F2 TASK дәрiгерлердiң тәжiрибесиндегi айырмашылықтарды азайтуға және медициналық шығындар мен қателiктердi төмендетуге бағытталған ауру факторларын талдаудың әртүрлi әдiстерi ұсынылады
F3 METHOD жiктеу ағашы
F4 METHOD жақын көршiлер әдiсi
F5 METHOD аңғал Байес
F6 METHOD кезейсоқ орман ағашы
F7 METHOD бустинг әдiстерi
F8 MATERIAL heart.csv датасетiне
F9 RESULT жүрек аурулары бойынша машинаға тиiмдi және дәлдiгi жоғары болатын болжам жасау үйретiлдi
F10 TASK Алгоритмдердiң болжау қабiлетiн арттыру мақсатында барлық әдiстер бiрiншi кезекте стандартталмаған деректерге оқытылды
F11 RESULT Standart Scaler әдiсiн қолдану арқылы деректердi стандартизациялау нәтижеге қаншалықты әсер ететiнiне зерттеу жүргiзiлдi
F12 RESULT бұл әдiс KNN мен SVC секiлдi алгоритмдерге нәтиженi шамамен 25%-ға жақсартуға көмек беретiнi анықталды
"
it-3768-2-kz.txt,"Бұл жұмыста бейiмделетiн көп агенттiк жүйе (Adaptive Multi-Agent System) тәсiлiне негiзделген роботтық манипуляторға арналған керi кинематика мәселесiнiң шешiмi ұсынылады. Бұл зерттеуде мульти-агенттiк жүйе төрт еркiндiк дәрежесi (DOF) бар робот қолы мен екi дөңгелегiн басқаруға жауапты. Роботтық қажеттi позиция және бағдарына жетуi үшiн, оның қолы мен дөңгелектерiне айналу бұрышы мен жылдамдық тәрiздi тиiстi командалар берiледi. Командаларды есептеу тура және керi кинематика есебiн шешумен тiкелей байланысты. AMOEBA-ның үйрену кезеңiне дейiн айналу бұрыштары бiр санына шифрланады. Бұл параметр болжау кезеңiндегi бiздiң болжам жасайтын негiзгi мән болып табылады. Үйрену кезеңiнде Agnostic MODEl Builder by self-adaptation (AMOEBA) жергiлiктi үлгiлерi бар және өзiн-өзi бейiмдей алатын контекстiк агенттердi құрады. Болжамды мән,, есептелiнiп алынғаннан кейiн, айналу бұрыштарының жиынтығын алу үшiн керi бағытта шифр ашылады. Бұл жиынтық роботтық атқарушы механизмi, яғни робот қолының саусақ ұшы, қажеттi позиция және бағдарға жетуi үшiн төрт еркiндiк дәрежелi қолы мен екi дөңгелегiне команда ретiнде берiледi. Сонымен қатар, робот өзiнiң барлық физикалық параметрлерiмен Robot Operating System (ROS) ортасында модельденедi және имитацияланады.","Бұл жұмыста [бейiмделетiн көп агенттiк жүйе (Adaptive Multi-Agent System) тәсiлiне негiзделген роботтық манипуляторға арналған керi кинематика мәселесiнiң шешiмi ұсынылады|F1|AIM]. Бұл зерттеуде [мульти-агенттiк жүйе төрт еркiндiк дәрежесi (DOF) бар робот қолы мен екi дөңгелегiн басқаруға жауапты|F2|TASK]. Роботтық қажеттi позиция және бағдарына жетуi үшiн, оның қолы мен дөңгелектерiне айналу бұрышы мен жылдамдық тәрiздi тиiстi командалар берiледi. Командаларды есептеу тура және керi кинематика есебiн шешумен тiкелей байланысты. [AMOEBA-ның|F3|TOOL] үйрену кезеңiне дейiн айналу бұрыштары бiр санына шифрланады. Бұл параметр болжау кезеңiндегi бiздiң болжам жасайтын негiзгi мән болып табылады. Үйрену кезеңiнде [Agnostic MODEl Builder by self-adaptation (AMOEBA) |F4|TOOL][жергiлiктi үлгiлерi бар және өзiн-өзi бейiмдей алатын контекстiк агенттердi құрады|F5|TASK]. [Болжамды мән,, есептелiнiп алынғаннан кейiн, айналу бұрыштарының жиынтығын алу үшiн керi бағытта шифр ашылады|F6|TASK]. [Бұл жиынтық роботтық атқарушы механизмi, яғни робот қолының саусақ ұшы, қажеттi позиция және бағдарға жетуi үшiн төрт еркiндiк дәрежелi қолы мен екi дөңгелегiне команда ретiнде берiледi|F7|RESULT]. Сонымен қатар, робот өзiнiң барлық физикалық параметрлерiмен [Robot Operating System (ROS|F8|TOOL]) ортасында модельденедi және имитацияланады.","F1 AIM бейiмделетiн көп агенттiк жүйе (Adaptive Multi-Agent System) тәсiлiне негiзделген роботтық манипуляторға арналған керi кинематика мәселесiнiң шешiмi ұсынылады
F2 TASK мульти-агенттiк жүйе төрт еркiндiк дәрежесi (DOF) бар робот қолы мен екi дөңгелегiн басқаруға жауапты
F3 TOOL AMOEBA-ның
F4 TOOL Agnostic MODEl Builder by self-adaptation (AMOEBA) 
F5 TASK жергiлiктi үлгiлерi бар және өзiн-өзi бейiмдей алатын контекстiк агенттердi құрады
F6 TASK Болжамды мән,, есептелiнiп алынғаннан кейiн, айналу бұрыштарының жиынтығын алу үшiн керi бағытта шифр ашылады
F7 RESULT Бұл жиынтық роботтық атқарушы механизмi, яғни робот қолының саусақ ұшы, қажеттi позиция және бағдарға жетуi үшiн төрт еркiндiк дәрежелi қолы мен екi дөңгелегiне команда ретiнде берiледi
F8 TOOL Robot Operating System (ROS
"
it-3942-2-kz.txt,"Қазақстанның оңтайлы геосаяси жағдайы мен Қытай мен Еуропа арасындағы жүк тасымалы саласында Қазақстан Республикасының үлкен транзиттiк әлеуетi көлiктiк-логистикалық саланы ел экономикасын дамыту үшiн перспективалы бағыттардың бiрi болып табылады. Осы тұрғыда отын тұтыну шығындарын азайту және адам еңбегiн пайдаланудың логистикалық үдерiстердiң iшiнде, сондай-ақ қоғамдық көлiктердегi жүктердi тасымалдау кезiнде пайдаланбайтын жүктердiң технологиясын пайдалану табиғи және тиiмдi болып көрiнедi. Бұл мақалада автономды жүк көлiгiнiң прототипi үшiн компьютерлiк көру модулiн әзiрлеу бойынша зерттеу жұмысының нәтижелерi сипатталған. Орындалған жоба кезеңдерi қажеттi жабдықты орнатуды, компьютерлiк көру үлгiлерiн дайындау және объектiлердi жiктеу және локализациялау мақсатында камералар мен LIDAR сенсоры арасындағы картаны әзiрлеудi қамтиды.","Қазақстанның оңтайлы геосаяси жағдайы мен Қытай мен Еуропа арасындағы жүк тасымалы саласында Қазақстан Республикасының үлкен транзиттiк әлеуетi көлiктiк-логистикалық саланы ел экономикасын дамыту үшiн перспективалы бағыттардың бiрi болып табылады. [Осы тұрғыда отын тұтыну шығындарын азайту және адам еңбегiн пайдаланудың логистикалық үдерiстердiң iшiнде, сондай-ақ қоғамдық көлiктердегi жүктердi тасымалдау кезiнде пайдаланбайтын жүктердiң технологиясын пайдалану табиғи және тиiмдi болып көрiнедi|F1|USAGE]. [Бұл мақалада автономды жүк көлiгiнiң прототипi үшiн компьютерлiк көру модулiн әзiрлеу бойынша зерттеу жұмысының нәтижелерi сипатталған|F2|AIM]. [Орындалған жоба кезеңдерi қажеттi жабдықты орнатуды|F3|RESULT], [компьютерлiк көру үлгiлерiн дайындау|F4|RESULT] және [объектiлердi жiктеу|F5|RESULT] және [локализациялау мақсатында камералар мен LIDAR сенсоры арасындағы картаны әзiрлеудi қамтиды|F6|RESULT].","F1 USAGE Осы тұрғыда отын тұтыну шығындарын азайту және адам еңбегiн пайдаланудың логистикалық үдерiстердiң iшiнде, сондай-ақ қоғамдық көлiктердегi жүктердi тасымалдау кезiнде пайдаланбайтын жүктердiң технологиясын пайдалану табиғи және тиiмдi болып көрiнедi
F2 AIM Бұл мақалада автономды жүк көлiгiнiң прототипi үшiн компьютерлiк көру модулiн әзiрлеу бойынша зерттеу жұмысының нәтижелерi сипатталған
F3 RESULT Орындалған жоба кезеңдерi қажеттi жабдықты орнатуды
F4 RESULT компьютерлiк көру үлгiлерiн дайындау
F5 RESULT объектiлердi жiктеу
F6 RESULT локализациялау мақсатында камералар мен LIDAR сенсоры арасындағы картаны әзiрлеудi қамтиды
"
