filename,abstract,aspect_annotation,aspects
it-2478-2-kz.txt,"Берiлген мақалада программалық жасақтама сәулетшiсiнiң CWE әлсiз жақтарын бiлудiң дамыған онтологиялық базасын қолдана отырып, оны жобалау кезеңiнде программалық жасақтаманың әлсiздiгiн ұйымдастыру мәселелерi қарастырылады. Бұл зерттеудiң негiзгi мақсаты - CWE негiзiндегi программалық жасақтама ақауларының жүйесiн талдау және программалық жасақтама сәулетшiлерi үшiн осы жүйенiң онтология моделiн (бiлiм базасын) жасау. Жасанды интеллект құралдарын қолдану, атап айтқанда, әлсiздiктерге негiзделген бiлiм базасын дамыту программалық жасақтаманың әлсiздiктерiн iздеуге және зерттеуге жаңа мүмкiндiктер бередi. Бұл әзiрленген модель программалық жасақтаманы әзiрлеушiлердiң, программалық жасақтама мен киберқауiпсiздiк саласындағы зерттеушiлердiң, сондай-ақ программалық жасақтаманы әзiрлеу технологиясы мен ақпараттық қауiпсiздiк курстарын жүргiзетiн оқу орындарының оқытушыла рына пайдалы болады. Бұл модель әзiрлеушiлерге программалық жасақтаманы жобалауда көмекшi және анықтамалық бола алады, өйткенi әлсiздiктер белгiлi қауiпсiздiк тактикасымен ұйымдастырылған, дизайнерге программалық жасақтама жасалғаннан кейiн әлсiз жерлердi табудың орнына жобалау процесiнде қауiпсiздiктi енгiзуге көмектеседi. Зерттеушiлерге өз жұмыстарында программалық жасақтаманың әлсiздiгiн зерттеу және қолдану мәселелерi қызықты болады. Оқытушылар бұл модельдi программалық жасақтама дизайнының немесе архитектурасының әлсiз тұстарындағы қауiпсiздiктi, сондай-ақ программалық жасақтаманы әзiрлеу кезiнде жасалуы мүмкiн қателiктердiң түрлерiн зерттеу және талқылау кезiнде анықтамалық материал ретiнде қолдана алады. Программалық жасақтама сәулетшiсiнiң функциялары талданады, CWE әлсiз жақтарын бiлудiң онтологиялық базасының мысалы келтiрiлген.","Берiлген мақалада [программалық жасақтама сәулетшiсiнiң CWE әлсiз жақтарын бiлудiң дамыған онтологиялық базасын қолдана отырып, оны жобалау кезеңiнде программалық жасақтаманың әлсiздiгiн ұйымдастыру мәселелерi қарастырылады|F1|TASK]. Бұл зерттеудiң негiзгi мақсаты - [CWE негiзiндегi программалық жасақтама ақауларының жүйесiн талдау және программалық жасақтама сәулетшiлерi үшiн осы жүйенiң онтология моделiн (бiлiм базасын) жасау|F2|AIM]. [Жасанды интеллект құралдарын қолдану|F3|METHOD], атап айтқанда, [әлсiздiктерге негiзделген бiлiм базасын дамыту|F4|TASK] [программалық жасақтаманың әлсiздiктерiн iздеуге және зерттеуге жаңа мүмкiндiктер бередi|F5|TASK]. Бұл әзiрленген модель [программалық жасақтаманы әзiрлеушiлердiң, программалық жасақтама мен киберқауiпсiздiк саласындағы зерттеушiлердiң, сондай-ақ программалық жасақтаманы әзiрлеу технологиясы мен ақпараттық қауiпсiздiк курстарын жүргiзетiн оқу орындарының оқытушыла рына пайдалы болады|F6|USAGE]. Бұл модель [әзiрлеушiлерге программалық жасақтаманы жобалауда көмекшi және анықтамалық бола алады, өйткенi әлсiздiктер белгiлi қауiпсiздiк тактикасымен ұйымдастырылған, дизайнерге программалық жасақтама жасалғаннан кейiн әлсiз жерлердi табудың орнына жобалау процесiнде қауiпсiздiктi енгiзуге көмектеседi|F7|USAGE]. [Зерттеушiлерге өз жұмыстарында программалық жасақтаманың әлсiздiгiн зерттеу және қолдану мәселелерi қызықты болады|F8|USAGE]. [Оқытушылар бұл модельдi программалық жасақтама дизайнының немесе архитектурасының әлсiз тұстарындағы қауiпсiздiктi, сондай-ақ программалық жасақтаманы әзiрлеу кезiнде жасалуы мүмкiн қателiктердiң түрлерiн зерттеу және талқылау кезiнде анықтамалық материал ретiнде қолдана алады|F9|USAGE]. [Программалық жасақтама сәулетшiсiнiң функциялары талданады|F10|RESULT], [CWE әлсiз жақтарын бiлудiң онтологиялық базасының мысалы келтiрiлген|F11|RESULT].","F1 TASK программалық жасақтама сәулетшiсiнiң CWE әлсiз жақтарын бiлудiң дамыған онтологиялық базасын қолдана отырып, оны жобалау кезеңiнде программалық жасақтаманың әлсiздiгiн ұйымдастыру мәселелерi қарастырылады
F2 AIM CWE негiзiндегi программалық жасақтама ақауларының жүйесiн талдау және программалық жасақтама сәулетшiлерi үшiн осы жүйенiң онтология моделiн (бiлiм базасын) жасау
F3 METHOD Жасанды интеллект құралдарын қолдану
F4 TASK әлсiздiктерге негiзделген бiлiм базасын дамыту
F5 TASK программалық жасақтаманың әлсiздiктерiн iздеуге және зерттеуге жаңа мүмкiндiктер бередi
F6 USAGE программалық жасақтаманы әзiрлеушiлердiң, программалық жасақтама мен киберқауiпсiздiк саласындағы зерттеушiлердiң, сондай-ақ программалық жасақтаманы әзiрлеу технологиясы мен ақпараттық қауiпсiздiк курстарын жүргiзетiн оқу орындарының оқытушыла рына пайдалы болады
F7 USAGE әзiрлеушiлерге программалық жасақтаманы жобалауда көмекшi және анықтамалық бола алады, өйткенi әлсiздiктер белгiлi қауiпсiздiк тактикасымен ұйымдастырылған, дизайнерге программалық жасақтама жасалғаннан кейiн әлсiз жерлердi табудың орнына жобалау процесiнде қауiпсiздiктi енгiзуге көмектеседi
F8 USAGE Зерттеушiлерге өз жұмыстарында программалық жасақтаманың әлсiздiгiн зерттеу және қолдану мәселелерi қызықты болады
F9 USAGE Оқытушылар бұл модельдi программалық жасақтама дизайнының немесе архитектурасының әлсiз тұстарындағы қауiпсiздiктi, сондай-ақ программалық жасақтаманы әзiрлеу кезiнде жасалуы мүмкiн қателiктердiң түрлерiн зерттеу және талқылау кезiнде анықтамалық материал ретiнде қолдана алады
F10 RESULT Программалық жасақтама сәулетшiсiнiң функциялары талданады
F11 RESULT CWE әлсiз жақтарын бiлудiң онтологиялық базасының мысалы келтiрiлген
"
it-2829-2-kz.txt,"Мақалада зерттелетiн объектiнiң динамика моделiнiң ақ шуларын және таратылған типтегi өлшеу жүйесiнiң сызықтық моделiнiң ақ шуларын есекере отырып, күй кеңiстiгi түрiндегi сызықтық стохастикалық үлестiрiлген модельдiң көмегiмен, жеке үй шаруашылығының кiрiстерi мен шығыстарының ақшалай жинақталуының эволюциясын модельдеу үшiн жүйелердiң пассивтi параметрлiк идентификациясының есебi қарастырылады. Ақырғы айырымдар әдiсiн қолдану дербес туындылы теңдеулер шешiмiн күй кеңiстiгi түрiндегi модельдермен ұсынылған сызықтық ақырғы-айырымдық және алгебралық теңдеулер жүйесiнiң шешiмiне келтiруге мүмкiндiк бередi. Объектiнiң әрекетiн дұрыс бағалау үшiн Калман сүзгiсiнiң алгоритмiн қолдану ұсынылды. Бiр үй шаруашылығының кiрiстерi мен шығыстарының ақшалай жинақталу эволюциясы теңдеуiнiң коэффициенттерiн бағалау мәселесiнiң тұжырымдамасы келтiрiлген. Есептегiштердiң қосымша ақ шуын ескере отырып, үй шаруашылығының кiрiстерi мен шығыстардың құрылымы сипатталған. Бiр үй шаруашылығының кiрiстерi мен шығыстардың ақшалай жинақтары эволюциясы күйiнiң кеңiстiгi түрiндегi теңдеу коэффициенттерiн бағалау мәселесiн шешудiң әдiстемесiн сандық апробациялау алгоритмi қарастырылған. Есептеулер Matlab математикалық жүйесiн қолдана отырып, ""Қазақстан Республикасы Стратегиялық жоспарлау және реформалар агенттiгi ұлттық статистика бюросы"" сайтынан алынған бес жылдағы бақылау деректерi негiзiнде жүргiзiлдi. Күй кеңiстiгi түрiнде бiр үй шаруашылығы үшiн ақша жинақтау теңдеулерiнiң коэффициенттерiн бағалауды пассивтi идентификациялау мәселесiн шешудiң ұсынылған әдiсi жеткiлiктi түрде әмбебап болып табылады.","Мақалада зерттелетiн объектiнiң динамика моделiнiң ақ шуларын және таратылған типтегi өлшеу жүйесiнiң [сызықтық моделiнiң|F1|METHOD] ақ шуларын есекере отырып, күй кеңiстiгi түрiндегi [сызықтық стохастикалық үлестiрiлген модельдiң|F2|METHOD] көмегiмен, [жеке үй шаруашылығының кiрiстерi мен шығыстарының ақшалай жинақталуының эволюциясын модельдеу үшiн жүйелердiң пассивтi параметрлiк идентификациясының есебi қарастырылады|F3|AIM]. [Ақырғы айырымдар әдiсiн қолдану|F4|METHOD] дербес туындылы теңдеулер шешiмiн күй кеңiстiгi түрiндегi модельдермен ұсынылған сызықтық ақырғы-айырымдық және алгебралық теңдеулер жүйесiнiң шешiмiне келтiруге мүмкiндiк бередi. Объектiнiң әрекетiн дұрыс бағалау үшiн [Калман сүзгiсiнiң алгоритмiн қолдану|F5|METHOD] ұсынылды. [Бiр үй шаруашылығының кiрiстерi мен шығыстарының ақшалай жинақталу эволюциясы теңдеуiнiң коэффициенттерiн бағалау мәселесiнiң тұжырымдамасы|F6|TASK] келтiрiлген. Есептегiштердiң қосымша ақ шуын ескере отырып, [үй шаруашылығының кiрiстерi мен шығыстардың құрылымы сипатталған|F7|TASK]. [Бiр үй шаруашылығының кiрiстерi мен шығыстардың ақшалай жинақтары эволюциясы күйiнiң кеңiстiгi түрiндегi теңдеу коэффициенттерiн бағалау мәселесiн шешудiң әдiстемесiн сандық апробациялау алгоритмi|F8|METHOD] қарастырылған. Есептеулер [Matlab математикалық жүйесiн|F9|TOOL] қолдана отырып, [""Қазақстан Республикасы Стратегиялық жоспарлау және реформалар агенттiгi ұлттық статистика бюросы"" сайтынан алынған бес жылдағы бақылау деректерi|F10|MATERIAL] негiзiнде жүргiзiлдi. [Күй кеңiстiгi түрiнде бiр үй шаруашылығы үшiн ақша жинақтау теңдеулерiнiң коэффициенттерiн бағалауды пассивтi идентификациялау мәселесiн шешудiң ұсынылған әдiсi жеткiлiктi түрде әмбебап болып табылады|F11|RESULT].","F1 METHOD сызықтық моделiнiң
F2 METHOD сызықтық стохастикалық үлестiрiлген модельдiң
F3 AIM жеке үй шаруашылығының кiрiстерi мен шығыстарының ақшалай жинақталуының эволюциясын модельдеу үшiн жүйелердiң пассивтi параметрлiк идентификациясының есебi қарастырылады
F4 METHOD Ақырғы айырымдар әдiсiн қолдану
F5 METHOD Калман сүзгiсiнiң алгоритмiн қолдану
F6 TASK Бiр үй шаруашылығының кiрiстерi мен шығыстарының ақшалай жинақталу эволюциясы теңдеуiнiң коэффициенттерiн бағалау мәселесiнiң тұжырымдамасы
F7 TASK үй шаруашылығының кiрiстерi мен шығыстардың құрылымы сипатталған
F8 METHOD Бiр үй шаруашылығының кiрiстерi мен шығыстардың ақшалай жинақтары эволюциясы күйiнiң кеңiстiгi түрiндегi теңдеу коэффициенттерiн бағалау мәселесiн шешудiң әдiстемесiн сандық апробациялау алгоритмi
F9 TOOL Matlab математикалық жүйесiн
F10 MATERIAL ""Қазақстан Республикасы Стратегиялық жоспарлау және реформалар агенттiгi ұлттық статистика бюросы"" сайтынан алынған бес жылдағы бақылау деректерi
F11 RESULT Күй кеңiстiгi түрiнде бiр үй шаруашылығы үшiн ақша жинақтау теңдеулерiнiң коэффициенттерiн бағалауды пассивтi идентификациялау мәселесiн шешудiң ұсынылған әдiсi жеткiлiктi түрде әмбебап болып табылады
"
