filename,abstract,aspect_annotation,aspects
it-1367-2-kz.txt,"Заманауи технологиялар негiзiнде қосымшалар форматын әзiрлеу қажеттiлiгi экологиялық бақылау жүйесiнiң тиiмдi жұмыс iстеуiнiң өзектiлiгiмен анықталады. Бұл жүйе бiрнеше өзара әрекеттесетiн модулдерден тұрады. Оның бiрi деректердi игеру алгоритмiн қолдана отырып, процестi моделдейтiн «деректердi игеру» модулi болып табылады. Тиiмдi моделдеу үшiн әзiрленген қосымшадан қалыптасатын Network Common Data Form (NetCDF) форматтағы бастапқы файлдар қажет. Бұл жұмыста NetCDF форматының сипаттамасы, ерекшелiктерi, құрылымы сипатталды, берiлген форматпен жұмыс iстейтiн қолданыстағы утилиттер және бағдарламалық қамтамалар, құралдар, визуализация бағдарламалары келтiрiлдi. Олардың қызметтерi мен функциялары талданды. MATLAB-қа альтернатива болатын Scilab математикалық бағдарлама көмегiмен құрылған NetCDF файлдары келтiрiлдi. Жұмыста атмосфералық ауаның ластаушылары бойынша әзiрленген деректер қоры көрсетiлдi. Негiзгi кестелер құрылымы сипатталды: өрiс, деректер типi, өрiс сипаттамасы, өрiс қасиетi. Деректер қорын құру үшiн MS SQL деректер қорын басқару жүейесi (ДҚБЖ) қолданылды. Әзiрленген деректер қорының реляциялық моделi келтiрiлдi. Ақпараттық- моделдеу жүйесiнiң негiзгi құрауыштарының өзара әрекеттесуi көрсетiлдi.","Заманауи технологиялар негiзiнде [қосымшалар форматын әзiрлеу қажеттiлiгi экологиялық бақылау жүйесiнiң тиiмдi жұмыс iстеуiнiң өзектiлiгiмен анықталады|F1|AIM]. Бұл жүйе бiрнеше өзара әрекеттесетiн модулдерден тұрады. Оның бiрi [деректердi игеру алгоритмiн|F2|METHOD] қолдана отырып, процестi моделдейтiн [«деректердi игеру» модулi|F3|TOOL] болып табылады. Тиiмдi моделдеу үшiн әзiрленген қосымшадан қалыптасатын [Network Common Data Form (NetCDF) форматтағы бастапқы файлдар|F4|MATERIAL] қажет. Бұл жұмыста [NetCDF форматының сипаттамасы, ерекшелiктерi, құрылымы сипатталды|F5|TASK], [берiлген форматпен жұмыс iстейтiн қолданыстағы утилиттер және бағдарламалық қамтамалар|F6|TASK], [құралдар, визуализация бағдарламалары келтiрiлдi|F7|TASK]. [Олардың қызметтерi мен функциялары талданды|F8|TASK]. [MATLAB-қа альтернатива болатын Scilab математикалық бағдарлама|F9|TOOL] көмегiмен құрылған [NetCDF файлдары|F10|MATERIAL] келтiрiлдi. [Жұмыста атмосфералық ауаның ластаушылары бойынша әзiрленген деректер қоры көрсетiлдi|F11|RESULT]. [Негiзгi кестелер құрылымы сипатталды: өрiс, деректер типi, өрiс сипаттамасы, өрiс қасиетi|F12|RESULT]. [Деректер қорын құру үшiн|F13|TASK] [MS SQL деректер қорын басқару жүейесi (ДҚБЖ)|F14|TOOL] қолданылды. [Әзiрленген деректер қорының реляциялық моделi келтiрiлдi|F15|RESULT]. [Ақпараттық- моделдеу жүйесiнiң негiзгi құрауыштарының өзара әрекеттесуi көрсетiлдi|F16|RESULT].","F1 AIM қосымшалар форматын әзiрлеу қажеттiлiгi экологиялық бақылау жүйесiнiң тиiмдi жұмыс iстеуiнiң өзектiлiгiмен анықталады
F2 METHOD деректердi игеру алгоритмiн
F3 TOOL «деректердi игеру» модулi
F4 MATERIAL Network Common Data Form (NetCDF) форматтағы бастапқы файлдар
F5 TASK NetCDF форматының сипаттамасы, ерекшелiктерi, құрылымы сипатталды
F6 TASK берiлген форматпен жұмыс iстейтiн қолданыстағы утилиттер және бағдарламалық қамтамалар
F7 TASK құралдар, визуализация бағдарламалары келтiрiлдi
F8 TASK Олардың қызметтерi мен функциялары талданды
F9 TOOL MATLAB-қа альтернатива болатын Scilab математикалық бағдарлама
F10 MATERIAL NetCDF файлдары
F11 RESULT Жұмыста атмосфералық ауаның ластаушылары бойынша әзiрленген деректер қоры көрсетiлдi
F12 RESULT Негiзгi кестелер құрылымы сипатталды: өрiс, деректер типi, өрiс сипаттамасы, өрiс қасиетi
F13 TASK Деректер қорын құру үшiн
F14 TOOL MS SQL деректер қорын басқару жүейесi (ДҚБЖ)
F15 RESULT Әзiрленген деректер қорының реляциялық моделi келтiрiлдi
F16 RESULT Ақпараттық- моделдеу жүйесiнiң негiзгi құрауыштарының өзара әрекеттесуi көрсетiлдi
"
it-1369-2-kz.txt,"Әлеуметтiк онлайн-сервистердiң кең таралуы және Үлкен Деректер технологияларының дамуы әлеуметтiк желiлердегi деректердi әртүрлi салаларда қолдануға деген қызығушылық тудырды. Қазiргi таңда контент анализ және ""әлеуметтiк желiлердi мониторлау""технологиялары танымалдылыққа ие болуда. Мұндай сервистердiң көпшiлiгi шетелдiк әзiрлемелер болып табылады және лингвистикалық сөздiктер ағылшын тiлiнде құрастырылған, сондықтан қазақ және орыс тiлдерiне бейiмделмеген. Мақалада елдiң/аумақтың әлеуметтiк көңiл күйiн бағалау және пайдаланушының контенттi қабылдауының эмоционалды түсiн анықтауға арналған, қазақ және орыс тiлдерiнiң, сонымен қатар ауызекi сөйлеу формаларының ерекшелiктерiне бейiмделген ""әлеуметтiк желiлердi мониторлау""ақпараттық жүйесiн жобалау және әзiрлеу процесi көрсетiлген. Жұмыста ақпараттық жүйе алгоритмiнiң функционалдық мүмкiндiктерiнiң сипаттамасы және моделдерi мен әдiстерi көрсетiлген. Сонымен қатар, әлеуметтiк көңiл күйдi бағалаудың өнiмдiк моделi және қоғамның оқиғаларды қабылдауының семантикалық моделi қарастырылған. Мықты және әлсiз тұстарын анықтау мақсатында пiкiрлердi мониторлау саласындағы әзiрлемелерге салыстырмалы анализ жүргiзiлген. Ақпараттық жүйе аудандық, республикалық және халықаралық деңгейде БАҚ-ты және әлеуметтiк- желiлердi мониторлауға, беделдердi басқаруға анализ жасауға, интернет контенттi пайдаланушының қабылдауына анализ жасауға мүмкiндiк бередi.","Әлеуметтiк онлайн-сервистердiң кең таралуы және [Үлкен Деректер технологияларының|F1|METHOD] дамуы әлеуметтiк желiлердегi деректердi әртүрлi салаларда қолдануға деген қызығушылық тудырды. Қазiргi таңда [контент анализ және ""әлеуметтiк желiлердi мониторлау""технологиялары|F2|METHOD] танымалдылыққа ие болуда. Мұндай сервистердiң көпшiлiгi шетелдiк әзiрлемелер болып табылады және [лингвистикалық сөздiктер|F3|MATERIAL] ағылшын тiлiнде құрастырылған, сондықтан қазақ және орыс тiлдерiне бейiмделмеген. [Мақалада елдiң/аумақтың әлеуметтiк көңiл күйiн бағалау және пайдаланушының контенттi қабылдауының эмоционалды түсiн анықтауға арналған, қазақ және орыс тiлдерiнiң, сонымен қатар ауызекi сөйлеу формаларының ерекшелiктерiне бейiмделген ""әлеуметтiк желiлердi мониторлау""ақпараттық жүйесiн жобалау және әзiрлеу процесi көрсетiлген|F4|AIM]. Жұмыста а[қпараттық жүйе алгоритмiнiң функционалдық мүмкiндiктерiнiң сипаттамасы және моделдерi мен әдiстерi көрсетiлген|F5|RESULT]. Сонымен қатар, [әлеуметтiк көңiл күйдi бағалаудың өнiмдiк моделi және қоғамның оқиғаларды қабылдауының семантикалық моделi қарастырылған|F6|RESULT]. [Мықты және әлсiз тұстарын анықтау мақсатында пiкiрлердi мониторлау саласындағы әзiрлемелерге салыстырмалы анализ жүргiзiлген|F7|RESULT]. [Ақпараттық жүйе аудандық, республикалық және халықаралық деңгейде БАҚ-ты және әлеуметтiк- желiлердi мониторлауға, беделдердi басқаруға анализ жасауға, интернет контенттi пайдаланушының қабылдауына анализ жасауға мүмкiндiк бередi|F8|USAGE].","F1 METHOD Үлкен Деректер технологияларының
F2 METHOD контент анализ және ""әлеуметтiк желiлердi мониторлау""технологиялары
F3 MATERIAL лингвистикалық сөздiктер
F4 AIM Мақалада елдiң/аумақтың әлеуметтiк көңiл күйiн бағалау және пайдаланушының контенттi қабылдауының эмоционалды түсiн анықтауға арналған, қазақ және орыс тiлдерiнiң, сонымен қатар ауызекi сөйлеу формаларының ерекшелiктерiне бейiмделген ""әлеуметтiк желiлердi мониторлау""ақпараттық жүйесiн жобалау және әзiрлеу процесi көрсетiлген
F5 RESULT қпараттық жүйе алгоритмiнiң функционалдық мүмкiндiктерiнiң сипаттамасы және моделдерi мен әдiстерi көрсетiлген
F6 RESULT әлеуметтiк көңiл күйдi бағалаудың өнiмдiк моделi және қоғамның оқиғаларды қабылдауының семантикалық моделi қарастырылған
F7 RESULT Мықты және әлсiз тұстарын анықтау мақсатында пiкiрлердi мониторлау саласындағы әзiрлемелерге салыстырмалы анализ жүргiзiлген
F8 USAGE Ақпараттық жүйе аудандық, республикалық және халықаралық деңгейде БАҚ-ты және әлеуметтiк- желiлердi мониторлауға, беделдердi басқаруға анализ жасауға, интернет контенттi пайдаланушының қабылдауына анализ жасауға мүмкiндiк бередi
"
it-1371-2-kz.txt,"Соңғы кездегi Интернет пен әлеуметтiк желiлердегi табиғи тiлдегi ақпараттың көлемiнiң күрт артуы компьютерлiк лингвистика саласындағы зерттеулер өте өзектi мәселе. Компьютерлiк лингвистика информатика сияқты есептеу ғылымының жаңа бағыты екенi белгiлi. Компьютерлiк лингвистика табиғи тiлдердi өңдеу (Natural Language Proccesing- NLP) есебiн шешумен айналысады. Түркi тiлдерiнiң бiрегей белгiлеу жүйесiн әзiрлеу түркi тiлдерiн компьютерлiк өңдеу саласының өзектi есебiнiң бiрi. Бiрегей белгiлеу жүйесi белгiлеулердi бiрегейлендiрiп, оларды түсiнудi жеңiлдетедi және түркi тiлдерiне ортақ қосымшаларды пайдалануға, түрлi лингвистикалық-статистикалық зерттеулер жүргiзуге және салыстырмалы талдау жасауға мүмкiндiк бередi. Бұл мақалада түркi тiлдерiнiң көптiлдi онтологиясын және бiрегей ортақ метатiл құру бойынша орындалып жатқан халықаралық жобада жоспарланған жұмыстардың кейбiр нәтижесi көрсетiлген. Онтологиялық моделдер арқылы түркi (қазақ, қырғыз, татар, түрiк, өзбек) тiлдерiнiң морфологиялық ережелерi формалданған. Бұл жұмыстың нәтижелерiн NLP есептерiн шешу үшiн қолдануға болады. Мысалы, корпустарды белгiлеуде, бiлiмдердi шығару жүйелерi, ақпараттық iздеу жүйелерi, машиналық аудары және басқалары.","Соңғы кездегi Интернет пен әлеуметтiк желiлердегi табиғи тiлдегi ақпараттың көлемiнiң күрт артуы компьютерлiк лингвистика саласындағы зерттеулер өте өзектi мәселе. Компьютерлiк лингвистика информатика сияқты есептеу ғылымының жаңа бағыты екенi белгiлi. Компьютерлiк лингвистика табиғи тiлдердi өңдеу (Natural Language Proccesing- NLP) есебiн шешумен айналысады. [Түркi тiлдерiнiң бiрегей белгiлеу жүйесiн әзiрлеу түркi тiлдерiн компьютерлiк өңдеу саласының өзектi есебiнiң бiрi|F1|TASK]. [Бiрегей белгiлеу жүйесi белгiлеулердi бiрегейлендiрiп, оларды түсiнудi жеңiлдетедi және түркi тiлдерiне ортақ қосымшаларды пайдалануға, түрлi лингвистикалық-статистикалық зерттеулер жүргiзуге және салыстырмалы талдау жасауға мүмкiндiк бередi|F2|USAGE]. [Бұл мақалада түркi тiлдерiнiң көптiлдi онтологиясын және бiрегей ортақ метатiл құру бойынша орындалып жатқан халықаралық жобада жоспарланған жұмыстардың кейбiр нәтижесi көрсетiлген|F3|AIM]. [Онтологиялық моделдер арқылы түркi (қазақ, қырғыз, татар, түрiк, өзбек) тiлдерiнiң морфологиялық ережелерi формалданған|F4|RESULT]. [Бұл жұмыстың нәтижелерiн NLP есептерiн шешу үшiн қолдануға болады|F5|USAGE]. Мысалы, [корпустарды белгiлеуде, бiлiмдердi шығару жүйелерi, ақпараттық iздеу жүйелерi, машиналық аудары және басқалары|F6|USAGE].","F1 TASK Түркi тiлдерiнiң бiрегей белгiлеу жүйесiн әзiрлеу түркi тiлдерiн компьютерлiк өңдеу саласының өзектi есебiнiң бiрi
F2 USAGE Бiрегей белгiлеу жүйесi белгiлеулердi бiрегейлендiрiп, оларды түсiнудi жеңiлдетедi және түркi тiлдерiне ортақ қосымшаларды пайдалануға, түрлi лингвистикалық-статистикалық зерттеулер жүргiзуге және салыстырмалы талдау жасауға мүмкiндiк бередi
F3 AIM Бұл мақалада түркi тiлдерiнiң көптiлдi онтологиясын және бiрегей ортақ метатiл құру бойынша орындалып жатқан халықаралық жобада жоспарланған жұмыстардың кейбiр нәтижесi көрсетiлген
F4 RESULT Онтологиялық моделдер арқылы түркi (қазақ, қырғыз, татар, түрiк, өзбек) тiлдерiнiң морфологиялық ережелерi формалданған
F5 USAGE Бұл жұмыстың нәтижелерiн NLP есептерiн шешу үшiн қолдануға болады
F6 USAGE корпустарды белгiлеуде, бiлiмдердi шығару жүйелерi, ақпараттық iздеу жүйелерi, машиналық аудары және басқалары
"
it-1558-2-kz.txt,Үш секторлы экономикалық кластердiң математикалық моделi үшiн уақыттың шексiз интервалында тиiмдi басқару есебi қойылады. Коэффициенттерi басқару объектiсiнiң қалып - күйiнен тәуелдi сызықты емес жүйенiң бiр класы үшiн тиiмдi тұрақтандыру есебi қарастырылады. Жүйенiң қалып - күйiнен және ағымдағы уақыттан тәуелдi болатын басқаруға қойылған шектеудi ескерiп сызықты емес тұрақтандырушы басқару табылды. Сызықты емес жүйелер үшiн алынған нәтижелер шексiз уақыт интревалында үш секторлы экономикалық кластерлерге арналған басқарушы параметрлердi құрастыру барысында қолданылады. Қарастырылып отырған мысал үшiн баланстық қатынасты қанағаттандыратын еңбек және инвестициялық ресурстардың тиiмдi үлестiрiмi анықталған. Келтiрiлген мысал сызықты емес жүйелердi басқару әдiстерiнiң тиiмдi қолданылуын сипаттайды.,[Үш секторлы экономикалық кластердiң математикалық моделi үшiн уақыттың шексiз интервалында тиiмдi басқару есебi қойылады|F1|AIM]. [Коэффициенттерi басқару объектiсiнiң қалып - күйiнен тәуелдi сызықты емес жүйенiң бiр класы үшiн тиiмдi тұрақтандыру есебi қарастырылады|F2|TASK]. [Жүйенiң қалып - күйiнен және ағымдағы уақыттан тәуелдi болатын басқаруға қойылған шектеудi ескерiп сызықты емес тұрақтандырушы басқару табылды|F3|RESULT]. [Сызықты емес жүйелер үшiн алынған нәтижелер шексiз уақыт интревалында үш секторлы экономикалық кластерлерге арналған басқарушы параметрлердi құрастыру барысында қолданылады|F4|USAGE]. [Қарастырылып отырған мысал үшiн баланстық қатынасты қанағаттандыратын еңбек және инвестициялық ресурстардың тиiмдi үлестiрiмi анықталған|F5|RESULT]. Келтiрiлген мысал [сызықты емес жүйелердi басқару әдiстерiнiң|F6|METHOD] тиiмдi қолданылуын сипаттайды.,"F1 AIM Үш секторлы экономикалық кластердiң математикалық моделi үшiн уақыттың шексiз интервалында тиiмдi басқару есебi қойылады
F2 TASK Коэффициенттерi басқару объектiсiнiң қалып - күйiнен тәуелдi сызықты емес жүйенiң бiр класы үшiн тиiмдi тұрақтандыру есебi қарастырылады
F3 RESULT Жүйенiң қалып - күйiнен және ағымдағы уақыттан тәуелдi болатын басқаруға қойылған шектеудi ескерiп сызықты емес тұрақтандырушы басқару табылды
F4 USAGE Сызықты емес жүйелер үшiн алынған нәтижелер шексiз уақыт интревалында үш секторлы экономикалық кластерлерге арналған басқарушы параметрлердi құрастыру барысында қолданылады
F5 RESULT Қарастырылып отырған мысал үшiн баланстық қатынасты қанағаттандыратын еңбек және инвестициялық ресурстардың тиiмдi үлестiрiмi анықталған
F6 METHOD сызықты емес жүйелердi басқару әдiстерiнiң
"
