filename,abstract,aspect_annotation,aspects
it-1814-2-kz.txt,"Бұл жұмыста мәтiндi автоматты өңдеудiң негiзгi кезеңi болатын қазақ тiлiндегi мәтiндi графематикалық талдау қарастырылады. Графемдi сипаттау үшiн әр түрлi класстық дескрипторлар қолданылады. Мәтiндi автоматты талдау кезiнде қандай есептер шешiлетiндiгi көрсетiлген. Мәтiнде сөйлемдерге бөлудiң алгоритмi де сипатталған, онда графематикалық талдау кезеңiндегi негiзгi мәселе - сөз бен сөйлем шекараларын дұрыс iздеу. Сонымен қатар бiрқатар түсiнiктемелер берiлген және де қосымша мысалдар келтiрiлген. Графематикалық талдаудың мәтiндi автоматты талдаудағы орны көрсетiледi. Графематикалық талдаудың есептерi көрсетiледi, графематикалық дескрипторлар анықталады, мәтiндi сөйлемдерге бөлу алгоритмi келтiрiледi және қазақ тiлiнiң графематикалық талдауышы сипатталады. Сондай- ақ, графематикалық талдау қандай мiндеттердi шешуi керек екендiгi, макро синтаксистiк талдауға байланысты дескрипторлар қарастырылған. Негiзгi графиктiк дескрипторлардың мысалдары келтiрiлген. Сонымен қатар макро синтаксистiк дескрипторлардың мысалдары келтiрiлген.Жұмыс барысында сипатталған барлық алгоритмдер Python программасында орындалған.","Бұл жұмыста [мәтiндi автоматты өңдеудiң негiзгi кезеңi болатын қазақ тiлiндегi мәтiндi графематикалық талдау қарастырылады|F1|AIM]. [Графемдi сипаттау|F2|METHOD] үшiн әр түрлi класстық дескрипторлар қолданылады. [Мәтiндi автоматты талдау кезiнде қандай есептер шешiлетiндiгi көрсетiлген|F3|TASK]. [Мәтiнде сөйлемдерге бөлудiң алгоритмi де сипатталған|F4|RESULT], [онда графематикалық талдау кезеңiндегi негiзгi мәселе - сөз бен сөйлем шекараларын дұрыс iздеу.|F5|RESULT] [Сонымен қатар бiрқатар түсiнiктемелер берiлген және де қосымша мысалдар келтiрiлген|F6|RESULT]. [Графематикалық талдаудың мәтiндi автоматты талдаудағы орны көрсетiледi|F7|TASK]. [Графематикалық талдаудың есептерi көрсетiледi|F8|TASK], [графематикалық дескрипторлар анықталады|F9|TASK], [мәтiндi сөйлемдерге бөлу алгоритмi келтiрiледi|F10|METHOD] және [қазақ тiлiнiң графематикалық талдауышы сипатталады|F11|TOOL]. Сондай- ақ, [графематикалық талдау қандай мiндеттердi шешуi керек екендiгi|F12|TASK], [макро синтаксистiк талдауға байланысты дескрипторлар қарастырылған|F13|RESULT]. [Негiзгi графиктiк дескрипторлардың мысалдары келтiрiлген|F14|RESULT]. Сонымен қатар [макро синтаксистiк дескрипторлардың мысалдары келтiрiлген|F15|RESULT].Жұмыс барысында сипатталған барлық алгоритмдер [Python программасында|F16|TOOL] орындалған.","F1 AIM мәтiндi автоматты өңдеудiң негiзгi кезеңi болатын қазақ тiлiндегi мәтiндi графематикалық талдау қарастырылады
F2 METHOD Графемдi сипаттау
F3 TASK Мәтiндi автоматты талдау кезiнде қандай есептер шешiлетiндiгi көрсетiлген
F4 RESULT Мәтiнде сөйлемдерге бөлудiң алгоритмi де сипатталған
F5 RESULT онда графематикалық талдау кезеңiндегi негiзгi мәселе - сөз бен сөйлем шекараларын дұрыс iздеу.
F6 RESULT Сонымен қатар бiрқатар түсiнiктемелер берiлген және де қосымша мысалдар келтiрiлген
F7 TASK Графематикалық талдаудың мәтiндi автоматты талдаудағы орны көрсетiледi
F8 TASK Графематикалық талдаудың есептерi көрсетiледi
F9 TASK графематикалық дескрипторлар анықталады
F10 METHOD мәтiндi сөйлемдерге бөлу алгоритмi келтiрiледi
F11 TOOL қазақ тiлiнiң графематикалық талдауышы сипатталады
F12 TASK графематикалық талдау қандай мiндеттердi шешуi керек екендiгi
F13 RESULT макро синтаксистiк талдауға байланысты дескрипторлар қарастырылған
F14 RESULT Негiзгi графиктiк дескрипторлардың мысалдары келтiрiлген
F15 RESULT макро синтаксистiк дескрипторлардың мысалдары келтiрiлген
F16 TOOL Python программасында
"
it-2100-2-kz.txt,"Қазiргi уақытта бағдарламалық жасақтама сапасының көптеген үлгiлерi (БЖС) жасалғанына қарамастан, ең жақсы нәтижеге ие әртүрлi бағдарламалық құралдарға қолданылатын әмбебап модель жоқ. Белгiлi бiр БЖ-дi бағалаудың сапасын талдау және бағалау үшiн олардың ерекшелiктерi мен оларға қойылатын талаптарды ескеретiн, сонымен қатар өмiрлiк циклдiң әртүрлi кезеңдерiндегi сапа көрсеткiштерiн неғұрлым дәл сипаттайтын сәйкес сапа моделiн таңдау қажет. Әрбiр нақты БЖСМ, әдетте, өзiндiк сипаттамалары мен сапалық атрибуттарымен сипатталады, өзiнiң артықшылықтары мен кемшiлiктерi бар. Осы сипаттамаларға сүйене отырып, модельдер қолданудың әртүрлi салаларына бағытталуы мүмкiн. Белгiлi бiр БЖ жобаларына сәйкес келетiн бiр немесе басқа БЖСМ, БЖ сипаттамалары мен сапалық атрибуттарын қолданудың орындылығын түсiну үшiн қолданыстағы БЖСМ ерекшелiктерiне жан-жақты талдау жүргiзу қажет. Бұл жұмыстың мақсаты - заманауи БЖСМ-ның сипаттамалары мен ерекшелiктерiне олардың мүмкiндiктерi мен қолданылуын, қолданылатын мәселенiң ерекшелiктерi мен талаптарына бейiмделу қабiлеттерiн бағалау үшiн жан-жақты салыстырмалы талдау жүргiзу. БЖСМ талдауы келесi аспектiлерде жүзеге асырылды: құрылымы, деңгейлерi мен сипаттамалары (сипаттамалары бойынша) және олардың семантикалық мазмұны, сонымен қатар мүмкiндiктердi анықтау және қолдану мүмкiндiгi. Негiзгi сипаттамаларды және негiзгi БЖСМ сипаттамаларын салыстырмалы талдау нәтижесiнде бағдарламалық қамтамасыздандырудың сапалық сипаттамаларына ең көп қолданылатын (негiзгi) сипаттамалар анықталды. Бағдарламалық жасақтаманың белгiлi бiр түрлерiне қолдану үшiн бұл негiзгi жиынтықты нақты сипаттамаларды және сипаттамаларды таңдау арқылы қолданбалы бағдарламаның тиiстi жағдайларына бейiмдеуге болады, сонымен қатар басқа модельдерден қажеттi сапалық атрибуттарды қосуға болады.","Қазiргi уақытта [бағдарламалық жасақтама сапасының көптеген үлгiлерi (БЖС)|F1|MATERIAL] жасалғанына қарамастан, ең жақсы нәтижеге ие әртүрлi бағдарламалық құралдарға қолданылатын әмбебап модель жоқ. Белгiлi бiр БЖ-дi бағалаудың сапасын талдау және бағалау үшiн олардың ерекшелiктерi мен оларға қойылатын талаптарды ескеретiн, сонымен қатар [өмiрлiк циклдiң әртүрлi кезеңдерiндегi сапа көрсеткiштерiн неғұрлым дәл сипаттайтын сәйкес сапа моделiн таңдау қажет|F2|TASK]. Әрбiр нақты БЖСМ, әдетте, өзiндiк сипаттамалары мен сапалық атрибуттарымен сипатталады, өзiнiң артықшылықтары мен кемшiлiктерi бар. Осы сипаттамаларға сүйене отырып, модельдер қолданудың әртүрлi салаларына бағытталуы мүмкiн. [Белгiлi бiр БЖ жобаларына сәйкес келетiн бiр немесе басқа БЖСМ, БЖ сипаттамалары мен сапалық атрибуттарын қолданудың орындылығын түсiну үшiн қолданыстағы БЖСМ ерекшелiктерiне жан-жақты талдау жүргiзу қажет|F3|TASK]. [Бұл жұмыстың мақсаты - заманауи БЖСМ-ның сипаттамалары мен ерекшелiктерiне олардың мүмкiндiктерi мен қолданылуын, қолданылатын мәселенiң ерекшелiктерi мен талаптарына бейiмделу қабiлеттерiн бағалау үшiн жан-жақты салыстырмалы талдау жүргiзу|F4|AIM]. БЖСМ талдауы келесi аспектiлерде жүзеге асырылды: құрылымы, деңгейлерi мен сипаттамалары (сипаттамалары бойынша) және олардың семантикалық мазмұны, сонымен қатар мүмкiндiктердi анықтау және қолдану мүмкiндiгi. [Негiзгi сипаттамаларды және негiзгi БЖСМ сипаттамаларын салыстырмалы талдау нәтижесiнде бағдарламалық қамтамасыздандырудың сапалық сипаттамаларына ең көп қолданылатын (негiзгi) сипаттамалар анықталды|F5|RESULT]. [Бағдарламалық жасақтаманың белгiлi бiр түрлерiне қолдану үшiн бұл негiзгi жиынтықты нақты сипаттамаларды және сипаттамаларды таңдау арқылы қолданбалы бағдарламаның тиiстi жағдайларына бейiмдеуге болады, сонымен қатар басқа модельдерден қажеттi сапалық атрибуттарды қосуға болады|F6|USAGE].","F1 MATERIAL бағдарламалық жасақтама сапасының көптеген үлгiлерi (БЖС)
F2 TASK өмiрлiк циклдiң әртүрлi кезеңдерiндегi сапа көрсеткiштерiн неғұрлым дәл сипаттайтын сәйкес сапа моделiн таңдау қажет
F3 TASK Белгiлi бiр БЖ жобаларына сәйкес келетiн бiр немесе басқа БЖСМ, БЖ сипаттамалары мен сапалық атрибуттарын қолданудың орындылығын түсiну үшiн қолданыстағы БЖСМ ерекшелiктерiне жан-жақты талдау жүргiзу қажет
F4 AIM Бұл жұмыстың мақсаты - заманауи БЖСМ-ның сипаттамалары мен ерекшелiктерiне олардың мүмкiндiктерi мен қолданылуын, қолданылатын мәселенiң ерекшелiктерi мен талаптарына бейiмделу қабiлеттерiн бағалау үшiн жан-жақты салыстырмалы талдау жүргiзу
F5 RESULT Негiзгi сипаттамаларды және негiзгi БЖСМ сипаттамаларын салыстырмалы талдау нәтижесiнде бағдарламалық қамтамасыздандырудың сапалық сипаттамаларына ең көп қолданылатын (негiзгi) сипаттамалар анықталды
F6 USAGE Бағдарламалық жасақтаманың белгiлi бiр түрлерiне қолдану үшiн бұл негiзгi жиынтықты нақты сипаттамаларды және сипаттамаларды таңдау арқылы қолданбалы бағдарламаның тиiстi жағдайларына бейiмдеуге болады, сонымен қатар басқа модельдерден қажеттi сапалық атрибуттарды қосуға болады
"
it-2104-2-kz.txt,"Мақалада деректер базасын және ақпарат қорғаудың тәсiлдерi сипатталған. Ақпараттық жүйелердегi кибершабуылдарға талдау. Деректер базасында сақталатын ақпаратты, сондайақ құрылымдалған және қҰрылымданбаған деректердi қорғау қызметтерiн ұсынатын кейбiр компаниялар қарастырылады. Дерекқорды қорғаудың дамыған моделi сипатталған, онда шифрлау және дешифрлау әдiсiнiң реттiлiгi көрсетiлген. Base64 криптографиялық шифрлау әдiсiн қолдануға негiзделген ақпаратты шифрлау / дешифрлау әдiстерiнiң алгоритмi жасалды. Бекiтiлген префикс сипатталған. Әр ASCII оқылатын таңба мен сан үшiн Base64 кодтау нәтижесi ұсынылған. Қысқа сипатталған инфляция префиксi. Deplhi бағдарламалау тiлiнде Embarcadero RAD Studio дамыту ортасында Windows басқа операциялық жүйелерi үшiн әзiрленген, басқа бағдарламалау тiлдерiмен және жүйелiк кiтапханалармен интеграцияны қолдана отырып, сипатталған алгоритмнiң бағдарламалық қамтамасыздандыруы iске асырылған. Пайдаланушыға алгоритм бойынша нұсқаулықтардың толық сипаттамасы келтiрiлген. Ұсынылған алгоритмнiң бағдарламалық қамтамасыз етiлуiне талдау жасалған.","Мақалада [деректер базасын және ақпарат қорғаудың тәсiлдерi сипатталған|F1|AIM]. [Ақпараттық жүйелердегi кибершабуылдарға талдау|F2|RESULT]. [Деректер базасында сақталатын ақпаратты, сондайақ құрылымдалған және қҰрылымданбаған деректердi қорғау қызметтерiн ұсынатын кейбiр компаниялар қарастырылады|F3|MATERIAL]. [Дерекқорды қорғаудың дамыған моделi сипатталған|F4|TASK], онда [шифрлау және дешифрлау әдiсiнiң|F5|METHOD] реттiлiгi көрсетiлген. [Base64 криптографиялық шифрлау әдiсiн|F6|METHOD] қолдануға негiзделген ақпаратты [шифрлау / дешифрлау әдiстерiнiң алгоритмi|F7|METHOD] жасалды. [Бекiтiлген префикс сипатталған|F8|RESULT]. [Әр ASCII оқылатын таңба мен сан үшiн Base64 кодтау нәтижесi ұсынылған|F9|RESULT]. [Қысқа сипатталған инфляция префиксi|F10|RESULT]. [Deplhi бағдарламалау тiлiнде Embarcadero RAD Studio дамыту ортасында Windows басқа операциялық жүйелерi үшiн әзiрленген, басқа бағдарламалау тiлдерiмен және жүйелiк кiтапханалармен интеграцияны қолдана отырып, сипатталған алгоритмнiң бағдарламалық қамтамасыздандыруы iске асырылған|F11|TOOL]. [Пайдаланушыға алгоритм бойынша нұсқаулықтардың толық сипаттамасы келтiрiлген|F12|RESULT]. [Ұсынылған алгоритмнiң бағдарламалық қамтамасыз етiлуiне талдау жасалған|F13|RESULT].","F1 AIM деректер базасын және ақпарат қорғаудың тәсiлдерi сипатталған
F2 RESULT Ақпараттық жүйелердегi кибершабуылдарға талдау
F3 MATERIAL Деректер базасында сақталатын ақпаратты, сондайақ құрылымдалған және қҰрылымданбаған деректердi қорғау қызметтерiн ұсынатын кейбiр компаниялар қарастырылады
F4 TASK Дерекқорды қорғаудың дамыған моделi сипатталған
F5 METHOD шифрлау және дешифрлау әдiсiнiң
F6 METHOD Base64 криптографиялық шифрлау әдiсiн
F7 METHOD шифрлау / дешифрлау әдiстерiнiң алгоритмi
F8 RESULT Бекiтiлген префикс сипатталған
F9 RESULT Әр ASCII оқылатын таңба мен сан үшiн Base64 кодтау нәтижесi ұсынылған
F10 RESULT Қысқа сипатталған инфляция префиксi
F11 TOOL Deplhi бағдарламалау тiлiнде Embarcadero RAD Studio дамыту ортасында Windows басқа операциялық жүйелерi үшiн әзiрленген, басқа бағдарламалау тiлдерiмен және жүйелiк кiтапханалармен интеграцияны қолдана отырып, сипатталған алгоритмнiң бағдарламалық қамтамасыздандыруы iске асырылған
F12 RESULT Пайдаланушыға алгоритм бойынша нұсқаулықтардың толық сипаттамасы келтiрiлген
F13 RESULT Ұсынылған алгоритмнiң бағдарламалық қамтамасыз етiлуiне талдау жасалған
"
